{
  "format": "urrf.universal-art-asset-provider-preflight.v0.1",
  "version": "0.1.0",
  "preflight_id": "urrf-provider-preflight-integration-v01",
  "source": "urrf-provider-preflight-evaluator",
  "expected_profiles": [
    "character",
    "creature",
    "prop",
    "vehicle",
    "structure",
    "environment",
    "vegetation",
    "resource",
    "vfx"
  ],
  "providers": [
    {
      "provider_id": "provider:external:infinigen",
      "provider_root": "83bdca7ae05e8330c67e2e8b80478704e36f723ee15f148046094929bce9f91d",
      "name": "Princeton Infinigen",
      "version": "main",
      "provider_type": "procedural-environment",
      "execution_mode": "external-process",
      "declared_runtime_status": "CONTRACT_ONLY",
      "health": {
        "status": "CONTRACT_ONLY",
        "runtime": "CONTRACT_ONLY"
      },
      "runtime_binding": "CONTRACT_ONLY",
      "runner_supplied": false,
      "command_configured": false,
      "capabilities": [
        "world.asset.building",
        "world.asset.environment",
        "world.asset.furniture",
        "world.asset.generate.procedural",
        "world.asset.rock",
        "world.asset.room",
        "world.asset.terrain",
        "world.asset.vegetation"
      ],
      "profile_bindings": [
        "structure",
        "environment",
        "vegetation",
        "resource"
      ],
      "license": {
        "code_status": "VERIFIED",
        "dependency_status": "REQUIRES_AUDIT",
        "model_weights_status": "REQUIRES_SEPARATE_AUDIT",
        "data_status": "REQUIRES_SEPARATE_AUDIT",
        "default_commercial_release": false,
        "blocked_reasons": [
          "DEPENDENCY_LICENSE_AUDIT_REQUIRED",
          "MODEL_WEIGHT_LICENSE_AUDIT_REQUIRED",
          "DEFAULT_COMMERCIAL_DEPENDENCY_DISABLED"
        ]
      },
      "authoritative": false,
      "checks": {
        "provider_root": true,
        "health_truthfulness": true,
        "license_audit_binding": true,
        "profile_binding": true,
        "authority_boundary": true
      },
      "pass": true
    },
    {
      "provider_id": "provider:external:make-it-animatable",
      "provider_root": "b86d73809928fd8d78af87ebe526b396a422def02445d06ca2a5f1d6c46e4561",
      "name": "Make-It-Animatable",
      "version": "main",
      "provider_type": "rigging",
      "execution_mode": "external-process",
      "declared_runtime_status": "CONTRACT_ONLY",
      "health": {
        "status": "CONTRACT_ONLY",
        "runtime": "CONTRACT_ONLY"
      },
      "runtime_binding": "CONTRACT_ONLY",
      "runner_supplied": false,
      "command_configured": false,
      "capabilities": [
        "asset.pose.initial",
        "asset.rig.predict",
        "asset.skin.predict"
      ],
      "profile_bindings": [],
      "license": {
        "code_status": "VERIFIED",
        "dependency_status": "REQUIRES_AUDIT",
        "model_weights_status": "REQUIRES_SEPARATE_AUDIT",
        "data_status": "REQUIRES_SEPARATE_AUDIT",
        "default_commercial_release": false,
        "blocked_reasons": [
          "DEPENDENCY_LICENSE_AUDIT_REQUIRED",
          "MODEL_WEIGHT_LICENSE_AUDIT_REQUIRED",
          "DEFAULT_COMMERCIAL_DEPENDENCY_DISABLED"
        ]
      },
      "authoritative": false,
      "checks": {
        "provider_root": true,
        "health_truthfulness": true,
        "license_audit_binding": true,
        "profile_binding": true,
        "authority_boundary": true
      },
      "pass": true
    },
    {
      "provider_id": "provider:external:spark-2.1.0",
      "provider_root": "e9b8c83a2d65b461ede913a05171dc8bc995eaf26aa9ffa1992a3e7e94c6678c",
      "name": "Spark 2.1.0 Gaussian Representation Provider",
      "version": "2.1.0",
      "provider_type": "representation",
      "execution_mode": "local",
      "declared_runtime_status": "CONTRACT_ONLY",
      "health": {
        "status": "CONTRACT_ONLY",
        "runtime": "CONTRACT_ONLY"
      },
      "runtime_binding": "CONTRACT_ONLY",
      "runner_supplied": false,
      "command_configured": false,
      "capabilities": [
        "asset.gaussian.build-lod",
        "asset.gaussian.convert",
        "asset.gaussian.edit-sdf",
        "asset.gaussian.ingress",
        "asset.gaussian.package-rad",
        "asset.gaussian.procedural-generate",
        "representation.visual.paged-residency",
        "representation.visual.portal",
        "representation.visual.raycast",
        "representation.visual.render",
        "representation.visual.stream",
        "representation.visual.xr"
      ],
      "profile_bindings": [],
      "license": {
        "code_status": "VERIFIED",
        "dependency_status": "NOT_AUDITED",
        "model_weights_status": "NOT_APPLICABLE",
        "data_status": "REMOTE_EXAMPLE_ASSETS_NOT_AUDITED",
        "default_commercial_release": false,
        "blocked_reasons": [
          "DEPENDENCY_LICENSE_AUDIT_REQUIRED",
          "MODEL_WEIGHT_LICENSE_AUDIT_REQUIRED",
          "DEFAULT_COMMERCIAL_DEPENDENCY_DISABLED"
        ]
      },
      "authoritative": false,
      "checks": {
        "provider_root": true,
        "health_truthfulness": true,
        "license_audit_binding": true,
        "profile_binding": true,
        "authority_boundary": true
      },
      "pass": true
    },
    {
      "provider_id": "provider:external:trellis-2",
      "provider_root": "f65ab9b82c18a54d9944811089285164a4ac6aeef1da27a19cc0e5b6ea03774b",
      "name": "Microsoft TRELLIS.2",
      "version": "main",
      "provider_type": "3d-production",
      "execution_mode": "external-process",
      "declared_runtime_status": "CONTRACT_ONLY",
      "health": {
        "status": "CONTRACT_ONLY",
        "runtime": "CONTRACT_ONLY"
      },
      "runtime_binding": "CONTRACT_ONLY",
      "runner_supplied": false,
      "command_configured": false,
      "capabilities": [
        "asset.generate.3d.production",
        "asset.generate.mesh",
        "asset.generate.pbr"
      ],
      "profile_bindings": [
        "character",
        "creature",
        "prop",
        "vehicle"
      ],
      "license": {
        "code_status": "VERIFIED",
        "dependency_status": "REQUIRES_AUDIT",
        "model_weights_status": "REQUIRES_SEPARATE_AUDIT",
        "data_status": "REQUIRES_SEPARATE_AUDIT",
        "default_commercial_release": false,
        "blocked_reasons": [
          "DEPENDENCY_LICENSE_AUDIT_REQUIRED",
          "MODEL_WEIGHT_LICENSE_AUDIT_REQUIRED",
          "DEFAULT_COMMERCIAL_DEPENDENCY_DISABLED"
        ]
      },
      "authoritative": false,
      "checks": {
        "provider_root": true,
        "health_truthfulness": true,
        "license_audit_binding": true,
        "profile_binding": true,
        "authority_boundary": true
      },
      "pass": true
    },
    {
      "provider_id": "provider:external:triposf",
      "provider_root": "0cdb4602efc6900402bf140ab33533462db93a12c74415aaba3568d55ab9825d",
      "name": "TripoSF",
      "version": "main",
      "provider_type": "geometry-refinement",
      "execution_mode": "external-process",
      "declared_runtime_status": "CONTRACT_ONLY",
      "health": {
        "status": "CONTRACT_ONLY",
        "runtime": "CONTRACT_ONLY"
      },
      "runtime_binding": "CONTRACT_ONLY",
      "runner_supplied": false,
      "command_configured": false,
      "capabilities": [
        "asset.refine.geometry"
      ],
      "profile_bindings": [],
      "license": {
        "code_status": "VERIFIED",
        "dependency_status": "REQUIRES_AUDIT",
        "model_weights_status": "REQUIRES_SEPARATE_AUDIT",
        "data_status": "REQUIRES_SEPARATE_AUDIT",
        "default_commercial_release": false,
        "blocked_reasons": [
          "DEPENDENCY_LICENSE_AUDIT_REQUIRED",
          "MODEL_WEIGHT_LICENSE_AUDIT_REQUIRED",
          "DEFAULT_COMMERCIAL_DEPENDENCY_DISABLED"
        ]
      },
      "authoritative": false,
      "checks": {
        "provider_root": true,
        "health_truthfulness": true,
        "license_audit_binding": true,
        "profile_binding": true,
        "authority_boundary": true
      },
      "pass": true
    },
    {
      "provider_id": "provider:external:triposr",
      "provider_root": "f80ea2cb90af28f2c4991153653efeb0f5148ecc355dd616460b81752dc26620",
      "name": "TripoSR",
      "version": "main",
      "provider_type": "3d-preview",
      "execution_mode": "external-process",
      "declared_runtime_status": "CONTRACT_ONLY",
      "health": {
        "status": "CONTRACT_ONLY",
        "runtime": "CONTRACT_ONLY"
      },
      "runtime_binding": "CONTRACT_ONLY",
      "runner_supplied": false,
      "command_configured": false,
      "capabilities": [
        "asset.generate.3d.preview",
        "asset.generate.mesh"
      ],
      "profile_bindings": [],
      "license": {
        "code_status": "VERIFIED",
        "dependency_status": "REQUIRES_AUDIT",
        "model_weights_status": "REQUIRES_SEPARATE_AUDIT",
        "data_status": "REQUIRES_SEPARATE_AUDIT",
        "default_commercial_release": false,
        "blocked_reasons": [
          "DEPENDENCY_LICENSE_AUDIT_REQUIRED",
          "MODEL_WEIGHT_LICENSE_AUDIT_REQUIRED",
          "DEFAULT_COMMERCIAL_DEPENDENCY_DISABLED"
        ]
      },
      "authoritative": false,
      "checks": {
        "provider_root": true,
        "health_truthfulness": true,
        "license_audit_binding": true,
        "profile_binding": true,
        "authority_boundary": true
      },
      "pass": true
    }
  ],
  "profile_routes": [
    {
      "index": 0,
      "asset_profile": "character",
      "asset_id": "asset:f67569af60b1c8e1f78cd3a5",
      "genome_root": "9bd6aedb7e404af241c2ab64b9ed23be99c50a06b91974cfeaa0bf8e7768dece",
      "required_capabilities": [
        "asset.generate.3d.production",
        "asset.generate.mesh",
        "asset.generate.pbr"
      ],
      "resolution_root": "c6ab4ae72d2e59a323464b6a6271406b1337587a14257a0f422ab6c83450b3fe",